{
  "$schema": "https://json-schema.org/draft/2020-12/schema",
  "title": "Factuurgegevens",
  "description": "Factuurgegevens van een afgesloten maand (gegevensklasse B). Geen factuur; de verrekening ontstaat in het financiele systeem.",
  "type": "object",
  "properties": {
    "opdracht_uri": {
      "type": "string",
      "format": "uri",
      "description": "URI van de opdracht."
    },
    "maand": {
      "type": "string",
      "pattern": "^\\d{4}-(0[1-9]|1[0-2])$",
      "description": "Maand, als JJJJ-MM."
    },
    "grondslag": {
      "type": "string",
      "enum": [
        "werkelijke_inzet",
        "vast_bedrag",
        "werkelijke_kosten"
      ],
      "description": "Grondslag: werkelijke inzet per maand, vast bedrag of werkelijke kosten."
    },
    "regels": {
      "type": "array",
      "description": "Regels.",
      "items": {
        "type": "object",
        "properties": {
          "omschrijving": {
            "type": "string",
            "description": "Omschrijving van de regel. Nooit een persoonsnaam."
          },
          "bedrag": {
            "$ref": "bedrag.schema.json"
          }
        },
        "required": [
          "omschrijving",
          "bedrag"
        ]
      }
    },
    "totaal": {
      "$ref": "bedrag.schema.json"
    },
    "afgesloten_op": {
      "type": "string",
      "format": "date-time",
      "description": "Moment waarop de maand is afgesloten. Met tijdzone (RFC 3339)."
    }
  },
  "required": [
    "opdracht_uri",
    "maand",
    "grondslag",
    "regels",
    "totaal",
    "afgesloten_op"
  ]
}
